<?xml version="1.0" encoding="UTF-8"?>
<?xml-stylesheet type="text/xsl" href="../XSLMedico.xsl"?>
<bbTrack xmlns:xsi="http://www.w3.org/2001/XMLSchema-instance" xsi:noNamespaceSchemaLocation="../XSDMedico.xsd">
		<Medico Licencia="M-23444">
			<Nombre>Miguel</Nombre>
			<Apellidos>Perez Jimenez</Apellidos>
			<Sexo>Hombre</Sexo>
			<Especialidad>Ginecologia</Especialidad>
			<Consultas>
				<idConsulta>2-02-HC</idConsulta>
			</Consultas>
		</Medico>
</bbTrack>
