<?xml version="1.0" encoding="UTF-8"?>
<?xml-stylesheet type="text/xsl" href="../XSLMedico.xsl"?>
<bbTrack xmlns:xsi="http://www.w3.org/2001/XMLSchema-instance" xsi:noNamespaceSchemaLocation="../XSDMedico.xsd">
		<Medico Licencia="M-99432">
			<Nombre>Maria</Nombre>
			<Apellidos>Pastor Smith</Apellidos>
			<Sexo>Mujer</Sexo>
			<Especialidad>Urgencias</Especialidad>
			<Consultas>
				<idConsulta>1-32-HCH</idConsulta>
			</Consultas>
		</Medico>
</bbTrack>
