<?xml version="1.0" encoding="UTF-8"?>
<?xml-stylesheet type="text/xsl" href="XSLMedico.xsl"?>
<bbTrack xmlns:xsi="http://www.w3.org/2001/XMLSchema-instance" xsi:noNamespaceSchemaLocation="XSDMedico.xsd">
		<Medico Licencia="M-10938">
			<Nombre>Antonio</Nombre>
			<Apellidos>Jurado Martos</Apellidos>
			<Sexo>Hombre</Sexo>
			<Especialidad>Urgencias</Especialidad>
			<Consultas>
				<idConsulta>1-22-HC</idConsulta>
			</Consultas>
		</Medico>
</bbTrack>
